num,domanda,opzione1,opzione2,opzione3,opzione4
1,Come ti vesti all'appuntamento?,A- ELEGANTE,B- CASUAL,C- ACCATTIVANTE,D- FELPONE FILA
2,Che regalo fai?,A- FIORI E CIOCCOLATINI,B- BASTO E AVANZO IO,C- LO STESSO ORSACCHIOTTO PER TUTTI,D- ROSA DEL BANGLA
3,Dove andate a cena?,A- RISTORANTE CON BELLA VISTA,B- PIZZERIA E NON OFFRO IO,C- SUSHI,D- KEBABBARO DI FIDUCIA
4,Di cosa parlate durante la cena?,A- QUANDO CI SPOSIAMO,B- PARLO DEL TEMPO,C- MI VANTO DELLE MIE CAPACITA' DI CONQUISTA,D- PARTE IL DISSING
5,Che dessert prendi?,A- UN TORTINO AL CIOCCOLATO CON DUE CUCCHIAINI,B- IO NON LO VOGLIO SE VUOI PRENDILO TU,C- SONO IL DESSERT,D- GELATO CONFEZIONATO
6,Cosa fate dopo cena?,A- PASSEGGIATA SOTTO LE STELLE,B- E' TARDI ANDIAMO!!,C- CINEMA,D- FACCIAMO LA LIMONATA
7,Che canzone della buonanotte scegli?,A- PERFECT,B- ACCENDO L'AUTORADIO,C- LA SHAMPISTA - Pagante,D- SENZ' E TE NON POZZ STA'
8,Dove faresti una vacanza romantica?,A- PARIGI,B- PISCINA COMUNALE,C- RICCIONE,D- ROMA NORD
